{
  "schemaVersion": 1,
  "packageName": "com.personal.alarmpyo",
  "versionName": "1.20",
  "versionCode": 20,
  "aabSha256": "aaaaaaaaaaaaaaaaaaaaaaaaaaaaaaaaaaaaaaaaaaaaaaaaaaaaaaaaaaaaaaaa",
  "sourceCommit": "bbbbbbbbbbbbbbbbbbbbbbbbbbbbbbbbbbbbbbbb",
  "easBuildId": "11111111-1111-4111-8111-111111111111",
  "r8Mapping": {
    "entryName": "BUNDLE-METADATA/com.android.tools.build.obfuscation/proguard.map",
    "sizeBytes": 1
  },
  "appSigningCertificateSha256": "ffffffffffffffffffffffffffffffffffffffffffffffffffffffffffffffff",
  "highestPreviouslyDistributedVersionCode": 18,
  "highestExistingPlayVersionCode": 19,
  "track": "closed",
  "checkedAt": "2026-08-24T12:00:00.000Z",
  "physicalDeviceEvidence": {
    "path": ".release/play/device-evidence/current-samsung.json",
    "sha256": "cccccccccccccccccccccccccccccccccccccccccccccccccccccccccccccccc"
  },
  "pageSize16KbEvidence": {
    "path": ".release/play/device-evidence/page-size-16kb.json",
    "sha256": "dddddddddddddddddddddddddddddddddddddddddddddddddddddddddddddddd"
  },
  "preLaunchReportEvidence": {
    "path": ".release/play/prelaunch-evidence/report.json",
    "sha256": "eeeeeeeeeeeeeeeeeeeeeeeeeeeeeeeeeeeeeeeeeeeeeeeeeeeeeeeeeeeeeeee"
  }
}
